Segment_ID,clean_text,y_val,y_pred,results
zknhrUs7-lI_4,with that they can then instantly come in and filter based on star level based on a price point even based on customer guest ratings,0,1,0
lp9vkkimXqg_6, and than ive encountered this serum,0,1,0
257771_5, uhh special effects were great but the cast that you knew nobody,1,0,0
CZigX1ntOsI_3,plus going to college is basically impossible for people without this important piece of paper,0,1,0
FHlzZ2VxuGQ_7,i call on jesus and i know him as my healer and my helper but this world this culture this generation does not,1,0,0
O2CEvvYWWbU_8,the last thing we got and definitely my favorite is allegedly whats gonna allow us to watch tv for days,1,0,0
33312_6, umm he plays the main character and he plays umm a big a big obese woman in the character as well and you know its about him trying to win his true love trying to impress this woman,1,0,0
IUmxJNs2zaY_1,these rivers are typical of many rivers in that their headwaters are located in mountainous areas—the rocky mountains and the alps in these particular cases,1,0,0
yDIFWzOBjXc_27,you no longer have to remember the category to which the task was assigned,1,0,0
JvLMNXW7B10_2,but the thing is is that the closing of the wedding anniversary speech can sometimes be the most difficult only in the sense of what do you say to wrap it up,0,1,0
128258_4, uhh it was very original,1,0,0
238063_6, umm beowulf is a good guy,1,0,0
108793_1, i was i was stutter really excited to see this movie,1,0,0
LKAEv8x9jKI_7,and just like you would in any market optimize your business model your cost structure your infrastructure around that one market and stop trying to solve the problem as health care and think of it as a one size fits all solution,0,1,0
2LpVvLemgvw_10,how did it work for you,1,0,0
fjE2EZKgQm8_1,other days maybe youll run calls,0,1,0
IawsOlEKRf0_3,and they come in a handy little package like this to keep everything from drying out,1,0,0
220548_12, if it was a movie like superbad umm which came out recently very very funny and its incredibly vulgar but thats not the basis of the humor,1,0,0
5qxZFmIaynE_29,the job duration will depend on what you are manufacturing,0,1,0
S2znq3iRPwE_9,i have been kinda worried you know choosing my first credit card cause a lot could go wrong but things have been going really great with the discover it,1,0,0
4WTVL5bNybU_1,many firms have not implemented policies to prevent the risks social media creates,0,1,0
YWxvIFmYnNU_11,if you’re talking about listing a house i always list with the realtor and i always do my paperwork with realtors,0,1,0
238023_11, uhh because my head will explode,0,1,0
137827_1, umm i picked up because i really liked the book,1,0,0
7vJy1zbopJ8_5,lets suppose that blows more wind at night how would i do to store it,1,0,0
91844_3, this is bound uhh starring jennifer tilly gina gershon and joe pantoliano and patoliano is incredible in this movie ive never seen him play a part this well,1,0,0
30162_11, ok,1,0,0
SxbTZjZD0vU_5,you need to get close to the root,0,1,0
125845_5, umm but stutter all the kids in the movie are great actors and great actresses they really have a good cast just think the writing could have been a little different,1,0,0
227426_16, a look at the women behind vanity fair,0,1,0
zjYEBwXGD8I_13, so weve actually done quite a few phone calls that were mystery shopping frontpoint  making sure that we understood how they treat their customers when it comes to tough issues or complaints or sales,0,1,0
9Un1O2ypJmI_1,ive seen business owners like you save many thousands of dollars by spotting hidden waste in their business and by just making a few improvements,1,0,0
cZDAM6NjBzE_12,the  second spot hasn’t changed that dramatically over the last  or  years,1,0,0
9GzFQBljNIY_3,they wobble back and forth between different ideas and different beliefs and things like this,1,0,0
RS5WM3q2ZZQ_3, the more information you ask for the less cards you are gonna have returned,0,1,0
Ua4g9q0r-dI_14,they want to know how much you can lift frequently how much you can lift occasionally,0,1,0
132028_4, umm the dvd however is quite good,1,0,0
2YwgSmmLibs_2,and while its not impossible but its not advised you know too many speakers today are getting in the business because theyve seen speakers from yesteryear and what they do and what theyre doing is theyre looking at them and modeling their business models,0,1,0
136211_7, umm its a perfect edition and basically if you love the rest of the die hards dont even hesitate go out and see it,1,0,0
YrPXbGBvqGo_12,but then the mind can also create neurosis and begin to suffer,0,1,0
y3r2kk8zvl0_1,but the core of the work that we do is about problem solving,1,0,0
3VsrcbjPwZY_7,i cant tell you how many times ive seen speeches of introduction where the speaker had to do this so now ladies and gentlemen its a great pleasure to present bob smith great come on out bob,0,1,0
ctMCSUT2LlQ_4,and get him ultimately to howard university here in washington for dental school,0,1,0
RImmdklTOW0_9, for things like acupressure it could be someones opinion from thousands of years ago,1,0,0
267799_18, and umm the final third was mixed it was okay,1,0,0
80914_4, uhh it has some funny jokes in it that are alright,1,0,0
ctMCSUT2LlQ_5,all of this is wrapped up in this ability to get around,0,1,0
gfHrSg3BwiQ_4,and as we understand it more you can see the repercussions of it in different areas,0,1,0
96361_7, this is back when uhh it was actually uhh mesquite carter i think is what it was,1,0,0
CwF97vXPYX4_4,we call on the government to permit its citizens to exercise their democratic rights and for all in equatorial guinea to address political differences through peaceful and consensual dialogue,0,1,0
255338_2, came out march two thousand eight,1,0,0
HabvL0VnrQ_8,now as your case progresses to trial and once youre at trial we have to put on whatever proof is necessary to prove your case,1,0,0
87400_12, if you havent seen oceans eleven go see it,1,0,0
3aD0xAgxxyw_18,i give it a  if you guys have seen it already id love to know what you guys thought of it,1,0,0
167521_1, by far live free or die hard or known as die hard four is probably my favorite as best movie in the die hard series,1,0,0
10219_6, you start learning more about the story,0,1,0
244180_7, they took away really important facts,0,1,0
jFNgOznarMo_13,in fact thats a lesson that many in of other parts of the world can learn as well,0,1,0
kPn-t6NSxfQ_1,a debt ratio of  means that debt finances half the assets,1,0,0
226601_17, uhh eleven deleted scenes and eleven behind the scenes featurettes umm and a lot of other stuff as well,1,0,0
11650_19, the previews showed the best parts of the movie,1,0,0
ZSBoSJaD2tQ_3, its impact on the global economy and across various industries can be gauged by the increase in innovations technical progress enhanced productivity and the workforce,0,1,0
JvgofTcCSEc_29,our customers come in with their dogs and i dont need dogs lifting their leg and peeing on merchandise throughout the store,0,1,0
fTNOAssiTYk_7,because investors its not about giving you a check and wishing you good luck,0,1,0
210433_3, uhh some of the comedy was good there was still a decent chemistry between uhh will smith and tommy lee jones,1,0,0
IawsOlEKRf0_24,one of these will usually last at least two weeks more if youre careful with it,1,0,0
24351_8, umm i was laughing stutter right through the movie,1,0,0
z0y1ZxH1f74_7,the department of state strongly recommends against all travel by us,0,1,0
245243_2, umm somehow they found a way to make each new iteration of the day uhh different fresh and it never gets boring in fact uhh as you go on you wait more and more to see uhh the familiar scenes play out in a different way and thats a lot of that credit goes to the script a lot of that credit goes to bill murray uhh and andie macdowell for keeping things fun,1,0,0
59673_4, and i always like it had been a movie in the back of my head that id been wanting to rent or buy for a long time,1,0,0
3QcqpwQiiLs_3,a metaanalysis of nine placebocontrolled human trials also concluded that grape seed extract significantly lowered high blood pressure,1,0,0
264446_11, and hes got a lot of uhh you know friends with him who kinda do much of the same,1,0,0
4HAC00EAdno_6,that really matters here you see that at these points the inequality holds on one side but not on the other,0,1,0
6slq62RwH3Q_6,so if you have a neighbor or friend or a family member tell them how much they mean to you and let them know that,1,0,0
221740_8, again its stuck on you the dvd movie starring greg kinnear and matt damon,1,0,0
ySblgk7T7eQ_9, it just says that the other guys view is as bad as yours and if your opponent can show that his view is not really analogous to your view then youre stuck with this unresolved problem,1,0,0
kU6YY2z7z0I_5,on entitlement reform we have already started down that path with the affordable care act obamacare,0,1,0
139006_1, umm im actually quite intrigued with the kind of like modernday zombie movies,1,0,0
255338_3, uhh went to see this with my younger sister,1,0,0
AlJX3Jw3xKk_3,and when they do that they dont have to pay taxes on the money,1,0,0
288766_23, umm so if you are fan of eastwood maybe check it out just to see him in what could be his last uhh acting role or starring acting role anyway,1,0,0
EEjCkc82oyk_11,if youve been arrested in las vegas or anywhere in the state of nevada call us at defense,0,1,0
247382_19, umm on the second disc are a bunch of uhh deleted scenes and also a level for the xbox game uhh stuff about the motion capture suit,1,0,0
216857_15, but umm uhh you know i would recommend it if you like the nicholas sparks books,1,0,0
WfNiQBXmPw8_2, but those taboos break down pretty quickly and soon roger is torturing other boys a job he really enjoys,0,1,0
65kkuNV921k_33,call me at  or email me at jayjaytownsendcom,0,1,0
92tWNUhG9DY_3,if there is anger and violence the illuminati will win and then the balance of the relationship between order and chaos shall be broken,0,1,0
jbKDW9URnvM_8,so youve got to be prepared and thats kind of what we talked about in the preproduction segment of it,0,1,0
4GYfmpEEtl4_1,have you ever gotten a promotional product invoice that was for a quantity more than what you ordered,0,1,0
damyXH7mBic_4,and ultimately they start to take on some bills and responsibilities of their own,0,1,0
OFBc3z99bIc_12,now my son being the computer savvy person that he is is sitting next to me while timothy is getting the numbers for what that diamond is worth,1,0,0
6RFVsOWK1m4_5,secondly you need to tell the patient what it is that you expect from them and any policies you have in your clinic about appropriate behaviour,0,1,0
125895_2, umm julie andrews stars as the queen and who comes and tells mia the secret that was kept from her her stutter whole life,1,0,0
241172_3, uhh this is origin stutter uhh basically uhh movie release in japan uhh in twothousandthree and this is a remake umm,1,0,0
uooIiW6dEyg_3, it is clear that if we raise our recycling targets and we create the conditions for a high quality recycling system we will obtain raw materials that instead of ending up in a landfill enter the cycle the market,0,1,0
136215_1, today i have another great movie for only in theater review for you and that is nancy drew,1,0,0
lp9vkkimXqg_16, so it kind of finishes of the facial treatment and it boosts the moisture up,1,0,0
FLyWn2DCci4_3,but there is no magic to belief,0,1,0
BdqoZ5qpz0E_6,nurses who have experience only in nonclinical roles are going to find it tough to perform some aspects of legal nurse consulting,0,1,0
T4e4Ba1sRg0_9,we consider the use of chemical weapons as a threat to international peace and security and we will continue to consult and keep the situation in syria under close review and nato continues to assist turkey and protect the alliances southeastern border,0,1,0
CzstrpOTtgo_3,its just so competitive theres so much talent and youre just not going to be fit right,1,0,0
197778_16, we watch it all the time,1,0,0
8qCNtqjygW8_13,bad movies can still be super fun,1,0,0
298774_9, one thing that i should warn you about is the movie will probably make you cry throughout the whole film,1,0,0
1tuMFJnlXJc_8,i encourage you to become a label reader and everything that you buy thats processed may have some sugar in it,0,1,0
209775_3, uhh i like uhh i think the performers are good performers richard gere and uhh catherine zeta jones and rene zellweger,1,0,0
130456_2, its umm definitely a cult movie favorite,1,0,0
D02PT0bl88A_1,im going to talk about how to write a good article summary,0,1,0
bdtwQxwySN0_11,when we lead someone to jesus the demons scream they absolutely hate it,1,0,0
lEsFI5YJGDo_10, thats exactly what i was missing,1,0,0
j1m6ctAgjsM_16, they have different quarterly meetings,0,1,0
JW2HHfQiGVs_4,learn stuff that you dont even know about through like someone like kyle someones been in the role before,1,0,0
R0o37yJ1PP0_5,the two important behaviors that define something as a sequence are that a sequence has a finite length and a sequence has an element thats another value corresponding to any nonnegative integer index less than its length starting at zero,0,1,0
OFBc3z99bIc_10,so i kept it and i thought that that part of it really made me feel even more comfortable and confident the fact that he wasnt trying to buy everything,1,0,0
kcIGTPHEsNo_1,so she said why dont you partner with people in the theatre department,1,0,0
ABSC1JNdpTw_11,so again our office is made up of three very distinct sections finances media and field,0,1,0
245243_1, starring bill murray uhh and andie macdowell and uhh directed by harold ramis who started with bill murray and stripes uhh seven years before umm this is one of my favorite comedies of the last say twenty years its a very simple premise done extremely well and the simple premise is that a man gets stuck reliving the same day over and over again until he gets it right uhh in this case its a weather man uhh played by bill murray who gets stuck in groundhog day in puxatony philadelphia or excuse me puxatony pennsylvania uhh until he gets the day right,1,0,0
225343_2, i uhh guess you could say a comedic gangster movie,1,0,0
108146_1, i saw oceans eleven and oceans twelve and i really like those,1,0,0
250430_4, umm it does have some good actors in it though forrest whitaker dennis quaid umm etcetera etcetera,1,0,0
209354_1, this is the widescreen special edition i find it to be very entertaining in widescreen much less than the full screen actually,1,0,0
fWOIAxzBQFY_12,we will cover topics like listening for incoming connections requests  receiving data from a client and sending data back to a client,0,1,0
TXCXFYIc3Yo_2,and the lord reminded me of this recently when my wife daughter and i went out shopping,1,0,0
ybK5wRaaUyE_2,they don’t think that they have to come out and be separate to follow jesus but satan knows that if he gets you to fellowship with sinners to take part in what they are doing then you won’t really have your eyes on jesus you won’t really follow jesus with your heart but you will just pay jesus lipservice but he will not have your heart,0,1,0
8404_13, so umm yep,1,0,0
221137_6, or harold and kumar go to white castle,0,1,0
fT6SrlsWV7M_11,but at the end of the day the evidence we uncover needs to stand up in court,1,0,0
260011_17, denzels the the good guy,1,0,0
Xx7Y2YIbleA_5,it doesnt mean that dividends are never due they just accumulate over a period of time,1,0,0
cEXJ2zFbC9I_4,and when the bond prices went down these loans were effectively called in and these portfolios of these retail investors were wiped out,0,1,0
IIPYcCii7Sg_1,dan this demonstration is part of the threeyear obsession of swedish born electronics expert mats jarlstrom after his wife got a ticket,0,1,0
luQfWSfb1s0_11, you also get to keep both your relationship with your students as well as your brand,0,1,0
131650_1, it is the blair witch project two book of shadows and blair witch project one i know a lot of people didnt really like it but i thought it was pretty good,1,0,0
XKyumlBmix8_4,so im going to do one more pass,0,1,0
fWOIAxzBQFY_10,this section will briefly cover the fundamental topics like a host an ip address a port number and things like telnet we are going to use the telnet utility in the sectiond section of our course,0,1,0
89951_11, but the dvd itself you know if youre a fan of the movie is uhh you know pretty complete,1,0,0
97095_8, just a lot of action,1,0,0
237009_4, umm i think since they had umm such a good one the first time,1,0,0
YfxtwXXkCmc_1, im a graduating senior,0,1,0
3MFNIag0wNE_1,im here tonight because i just have something to get off my chest,0,1,0
fz-MzQcOBwQ_3, this guys an engineer and he takes it very systematically,1,0,0
70420_3, im scared of anything so it was kind of scary,1,0,0
239572_9, umm it made you laugh so i really enjoyed this movie,1,0,0
W-q9bPlMIVI_8,now you should know my reputation is i am tough but fair,1,0,0
OFia3dWgaoI_4,i think that that skinny bill that baitandswitch bill whatever you want to call it trojan horse repeal bill that bill is not where we will end up at,0,1,0
McnbZjgCPLw_22,so i think that the persistence persistence desire commitment those are the three things that i would answer most to that question,0,1,0
TVhXqAI9gyA_2,its very difficult to put a convention together using subject matter thats completely unfamiliar,0,1,0
121128_6, uhh i would recommend it to anyone,1,0,0
y3r2kk8zvl0_7,and sometimes you may end up missing out on a truly innovative solution if you do that if you close out a problem very quickly,0,1,0
3At-BKm9eYk_7,she didn’t say anything but stayed until i left the school,1,0,0
3lkn8MS3n8Q_10,like if someone told you that in four years you were going to have to pick one musical note to listen to for the rest of your life you would spend a lot of time being super anxious about which note to pick and the various tonal qualities of different notes,0,1,0
LAj3rqJvS3s_2,at the event silicon valley bank chairman roger dunbar said that he is worried that auditing firms are trying to get audited companies to spend money with them on consulting in addition to their regular audits,0,1,0
125845_3, umm steve martin uhh and bonny hunt do a great a job acting steve martin is hilarious as ever umm but it wasnt the best family movie in the world,1,0,0
4HAC00EAdno_11,in this case this happens at x and x since the denominator of the left hand side of the inequality is zero there,1,0,0
uogwnZGb-iE_5,so im not i dont have as much time to make videos for you guys,0,1,0
4lKz4xyCmkk_12,three face the deaf or hearingimpaired person before you start speaking,0,1,0
DR9Hhpy8aA8_3,when we originally bought the home we had to put down a down payment,0,1,0
UTNP1roJV3I_2,hes from the denver broncos another team,0,1,0
I3SPlbTGuNc_8, and we’ve also announced that we’re going to seal the outback way the first time a government has made a commitment to deliver only the third sealed road between our eastwest connections across australia,0,1,0
TWszOxkOV0w_3,so i believe very strongly that the average tax payer in the us,0,1,0
nKiC9sEP2vM_17,peru’s program includes individual catch quotas a gps ship tracking system and inspectors at every factory,0,1,0
Fy0Uid9afM8_6,basically in france we have this idea that race doesn’t exist,1,0,0
MpuWcGn2Lcg_5,she was she was super like aware of everything,1,0,0
faXGVcVcVsE_5, uou always want to see if theres any changes in the patients condition which can tell you whether theyre improving or getting worse,1,0,0
61531_7, actually its one of the greatest one of the greatest cartoons ever made,1,0,0
RgubFcmvgDE_1,this cruelty caused me to have second thoughts about all animals and how we humans treat them,0,1,0
ZMAoUt0SD7E_1,the safety of your snake something you need to consider before actually bringing your snake home,0,1,0
9PzZSheh10U_4, ill see you in a moment,0,1,0
76124_1, uhh this umm you can call it pretty much an exorcism movie,1,0,0
y5JdqGL5DRc_4,now traditionally birthday speeches only happen at milestone occasions but you never know when you are going to be asked to give one so you really want to be prepared,1,0,0
uogwnZGb-iE_6,so thats the main reason and everythings going to be okay,1,0,0
JdFaSggG58c_3,does your mood rise and fall with the stock market,0,1,0
jZe-2w7pkd8_19,so do your original work keep reading plays find new plays look at contemporary plays and commit yourself to finding something that has not been done before,1,0,0
3fhCxePBuZY_12, why am i telling you this im telling you this because youve just been served with papers for a temporary order hearing or youre preparing for a temporary order hearing yourself in the state of texas,0,1,0
b86B3hP8ARM_5,traders and bond dealers have gotten together with mutual fund companies and actually bundled up various offers for various municipalities with high specialties,1,0,0
kh6eynD9OIk_1, we were walking with her on a boardwalk and there was a gentleman who was roasting peanuts,1,0,0
MNLG4-diuYM_7,i would do a lot of these sets until i couldn’t take it anymore,1,0,0
yxZydS2qHzs_3,well for you to save face and not be or to certainly help your absolute mortification that nobody laughed at your joke come up with something funny,0,1,0
VjAvqFXEmmk_6,takeaway number three the law of fabulous,0,1,0
224869_5, it works it from the very beginning all the way through,1,0,0
OSyKmOye5Uo_1,you may be a piano owner who has a piano that needs some repairs and youd like to try to tune it or repair it yourself,0,1,0
3V2qm0rw920_9,she has designed it for anyone interested in psychological theories of social change and the transformative potential of womens activism,0,1,0
60037_3, so i would give this a stutter enthusiastic five out of five rating,1,0,0
Ua4g9q0r-dI_31,thats my thought about preparing for questions that you know youre going to get,0,1,0
RImmdklTOW0_5, i dont even know if something works for me unless i try it,1,0,0
UcINGGuysBE_1,and then there are the learning skills,0,1,0
210618_16, movie really good movie you watch it youll have lots of laughs,1,0,0
234046_2, umm his character is john constantine hence the title and this is based on a series of uhh graphic novels and he he stutter can see demons and he can see umm otherworld spirits and he basically fights them,1,0,0
186631_12, its just a wonderful movie for all ages so if you want to see something thats very entertaining with a lot of laughs and even get educated about how to cook with a uhh profession such as a gourmet chef from france youll love remy,1,0,0
unOeTDc2rlY_8,question i read on the application that the team exercise is optional,0,1,0
37117_12, umm yes but so so stutter guys get it for your girlfriends and girls get it for yourself but anything other than that you probably wanna skip over it,1,0,0
4lro65JwQdc_4,this course so basically youre going to have five youre gonna choose five topics and have five links  to five different web sites or articles and then youre going to have five one hundredword rationales,0,1,0
VybXjsmsjAY_6,we will also discuss some scenarios on illegal discrimination,0,1,0
7IxmlIwqigw_9,and then on the leisure side you know we all learned a word that is not a friendly word in the airline language which is a staycation,0,1,0
HIsJqphLCyw_2, as any other human being i would obviously protect my family by using any means available,0,1,0
1A-aRhYx-GQ_4,before i discovered the jump manual and started using the jump manual workouts i was pretty much an average jumper,0,1,0
76124_8, umm this right here has got some special features including umm an alternate ending which is pretty interesting we were watching that,1,0,0
zk2jTlAtvSU_5,they also discuss how many directors there are going to be the duration of the terms for the directors and what qualifications the corporation requires for its board of directors,0,1,0
RS5WM3q2ZZQ_6, there are so many moving pieces here,0,1,0
QOxIdbNwpx0_2,it also makes it easier for the content publishers to track user engagement coming from your application,0,1,0
271598_16, and uhh well its supposed to sort of have the message that everyones vote matters and voting is important and look at the american political system,0,1,0
70710_3, it has subtitles in english and french and it also has not one comedian on it xxx i cant find it but it has comedian on it but xxx pretty funny on tv a lot,1,0,0
80566_7, its its stutter a good set of movies because the story it tells is quite good uhh its got good acting its its stutter one of those things that are original that are icons of america and american cinema like the godfather or,1,0,0
84176_4, umm this right here is hulk,1,0,0
IHp8hd1jm6k_1, whats lacking communication skills,0,1,0
Ve-mmCM8TI0_2,second cheapestfirst search in which we always expand first the path with the lowest total cost,0,1,0
Xx7Y2YIbleA_6,companies may look to pay out dividends as incentives but again reinvesting it in the business is usually the path that is chosen,0,1,0
276217_20, hes a really good actor,1,0,0
PoKZEKOf1dA_3, if you do have your insurance policy such as your insurance declarations page thats helpful for us to know what coverage you may have,0,1,0
239235_14, uhh my favorite songs are in this movie from uhh out of all the disney princess movies,1,0,0
2QXHdu2zlQY_2,there’s a lot of real labor there’s a lot of real capital that goes into the game,1,0,0
0K7dCp80n9c_8,so do it right away dont wait until the problem arises use rust out,1,0,0
110766_9, i mean if youre a chick maybe a four out of five maybe,1,0,0
fcxbB7ybUfs_9,is it going to grow at  or  so that you can forecast what your nest egg is going to be when you retire,0,1,0
zoPOeViAdOo_1,you do not want the humorous portion of the program to go on and on and on,0,1,0
TH32jop4FiI_7,also last week the state requested an emergency stay from the us supreme court,0,1,0
