Segment_ID,clean_text,y_val,y_pred,results
208416_11, its a little bit long but theres a lot action and it will really just draw you in and the time will go by quickly,1,0,0
j1m6ctAgjsM_12, they dont just willynilly have meetings at random times,1,0,0
fOxg1NstCHA_4,he has also served as the head of corporate communications for business software incorporated,0,1,0
L8VjQM9HQfs_3,“conflicts of interest” arise whenever private and public interests are in tension with each other in one and the same person,0,1,0
k4T6GaDrcjs_11, finn a sweetheart but not always the brightest accepted that he was the father even though they hadnt had sex,1,0,0
130426_5, and what made the first two movies great was like the kung fu and hand to hand action,1,0,0
CHh6hWo1AFE_1,but in the buildup to an election whats happening is that youre getting called on the phone and being asked to give away your valuable personal information,0,1,0
zaTyjiyrHnk_3,but in speeches its a good thing its a positive thing tonot all the time but several timescontinually repeat something,1,0,0
jLN6B0aSrW0_3,then we send that via bluetooth to your mobile and we portray your reactions in real time as your body is responding to those situations you can see it,0,1,0
70280_1, this is a new movie uhh in which a character is confined to his house he is under house arrest and his mother takes away his xboxes and tv as sort of a little bit of additional punishment,1,0,0
21638_3, umm its a really stylized film so you can really get the grittiness of war thats going on all the battles and stuff in this in the movie,1,0,0
MPRqaQqrd9Y_12,if your interest rate say example is nine percent for the year youre going to calculate and divide that by three hundred sixtyfive days to get that actual number that they would times by those thirty days,0,1,0
OxyQSJMvWBo_5,we can picture a developer designer,0,1,0
fbSxct2JcKU_3,but in asian cultures one does not typically say blessyou,1,0,0
8qCNtqjygW8_12,but that doesn’t mean you shouldn’t watch them,1,0,0
245582_9, and umm there were probably two or three things that were kind of entertaining for me which is a surprise cuz i expected much of my expectations were much lower than two or three laughs,1,0,0
