Segment_ID,clean_text,y_val,y_pred,results
X2Hs89fZ2-c_6, and then the last part arctoolbox the last component is the one we will be exploring towards the end of the course,0,1,0
cOcNe3L4VAg_13, by having all of these platforms integrated were able to see where we can automate processes to help streamline and create efficiencies,0,1,0
HJTxq72GuMs_10,in the more medium term i think how to change cultural values and traditions become s a much more longer term issue but having role models having girls understand that their self esteem should not just be measured by that fact that theyre married and having children needs to be changed,0,1,0
5i6AgQSjXO4_5,for scientific samples to be gathered the arctic must be preserved,0,1,0
56006_3, uhh event horizon its a really cool concept actually event horizons actually uhh the point in space in which you cant get sucked or which outside of you cannot get sucked in to a black hole,1,0,0
CQnwOZRgQXs_5,any type of violin will do for a beginning violinist you dont have to be like the symphony and spend  on a mahogany onepiece back violin,1,0,0
0Svu5BldR5A_11,they can also use handwriting in forensics in police work,0,1,0
8404_4, it has a great storyline the actors were great there was nothing bad about this movie,1,0,0
6ywl-j2-e-s_1,it may too be prompted by a violent context in which individuals fear for their life liberty and security,0,1,0
G38DwNDQ8Cc_3,imagine that he also managed to take out several credit cards in your name,0,1,0
Wrcf2xtqbkQ_1,im a fellow at the committee of conscience at the us holocaust museum and im undertaking a research project that is pegged to the upcoming trial in the hague of the alleged bosnian war criminal ratko mladic who is the most prominent of all the people whove been indicted by the yugoslav war crimes tribunal in the hague,1,0,0
kCQqLNiO0mk_7,if we dont  we dont invest wisely  were going to be hurting our schools were going to be hurting basically our future,0,1,0
nHP7l5zAwGA_8,the answer is “no” most candidates fail to pass the certification exam because they think they have completed related material and course now they are ready to win the title,0,1,0
YLK58srjhNI_8,of course we had fewer people here than they did in europe,0,1,0
10219_13, theyre just uhh great dvds,1,0,0
GmpDbIstUdc_6,im always on time im punctual then it comes to tell me something about your weaknesses an example might be well you know im the kind of person that once i get started on a task i have difficulty getting off that task and getting on to something else you always want to have with the weakness what youve done to compensate for that,0,1,0
270665_5, and its all about him and his life and hes so cool,1,0,0
272375_7, umm he was in the movie the voice of a one of the characters in kung fu panda,1,0,0
7pZPQbMKGkY_1,i am here today to discuss filing a chapter  case for you in order to get rid of your underwater junior mortgages,0,1,0
FaHosBIr0xY_7,and in some ways you could argue that just the concept of a superpower is going to become a little irrelevant because there be    perhaps economic powers that will anchor the world,0,1,0
JCg26b8EO48_9,heaven could be happening all around on this street in this town,1,0,0
223431_3, uhh the movie was a classic alien versus predator,1,0,0
NoOt0oU843M_2,as we look at equipment particularly tractors we know the specifications of that equipment is very important to you,0,1,0
29044_6, umm it was really more of a psychological drama kind of movie,1,0,0
Vuay0mVKkik_3,and when i was going to school it was really difficult for me to find avenues and resources to be able to reach higher education,0,1,0
Ua4g9q0r-dI_23,why could you not do it you want to have a two or three sentence explanation,1,0,0
CzstrpOTtgo_4,first of all no that they dont always take the best auditioner they take the person who fits the role the best who everyone on the panel can agree on,0,1,0
jQ3EmbRIe58_10,so the next quarterly town hall is happening on may th from  to  am,1,0,0
184784_2, basically after the first movie ends and they spend their weekend with bernie umm these two guys uhh go to their bank and find out theyre fired umm and they also find out that bernie when he was alive had stolen two million dollars and its in the virgin islands,1,0,0
PtdK-TLOuD0_2,as economic conditions become more uncertain these providers are under greater pressure to improve their it infrastructure,0,1,0
244829_3, it was it was stutter kind of an intriguing umm idea kind of thing,1,0,0
1W38PnuWIkM_3,she wanted to speak out  she wanted people to know the truth about what was happening in her country,1,0,0
zk2jTlAtvSU_3,they differ from the articles of incorporation generally in that they are not filed with the secretary of states office in the state in which the corporation is incorporated,0,1,0
UtjenieM1Ak_3,make sure that all your licensing is in place and of course you would basically take the time with every client to solve as much of their financial affairs as you can using annuities as a solution,0,1,0
UUukBV82P9A_7,it just needs to be important to other people who use the status as their primary way of locating that person in the social hierarchy,0,1,0
6slq62RwH3Q_11,so what i want to tell you with that thats all i want to say and ahh,0,1,0
2HP4KedfmSc_3,in the s they started buying works by emerging artists artists who werent known but actually went on to become some of the giants of the modern art scene,0,1,0
Ja7phs8EbWk_5,please note that there will be no opportunities for extra credit so don’t ask,0,1,0
jUKH63mltLE_10,but we have to give the speaker a fair shot at expressing his or her ideas and opinions right,0,1,0
gL8h7lOPv1Q_8,dude i feel like ive got barkley the dog from sesame street hanging out here with me,1,0,0
c5VEvmutmVg_12, male speaker karina wants to know how much time does the crew spend working outside the space station frank de winne well karina actually the crew spends little time working outside the space station because its very dangerous,0,1,0
275620_16, uhh production featurettes about previsualization models and uhh press conference for star trek five,1,0,0
272624_17, and thats my review of the mummy tomb of the dragon emperor,1,0,0
-egA8-b7-3M_2,in this video i share tips about exhibiting your services at an attorney conference,0,1,0
LL02UFLfQKo_7,this is patrick munro talking about the new technology of life settlements in the world of financial planning,0,1,0
130633_1, this film comes uhh from korea and it is highly regarded as uhh just a great film overall,1,0,0
288766_16, umm eastwood was great in the movie,1,0,0
233356_3, okay here are the good things i can say about this movie,1,0,0
2f6ZHqJ76EU_11,and what we have to do is make people understand that first of all getting into debt isnt necessarily an easy solution,0,1,0
03X1FwF6udc_4,because you want to make sure that after as your income comes in and youve paid all of your fixed and your variable expenses that you have some money that you can actually dedicate to a savings plan,0,1,0
k4T6GaDrcjs_3,and the next years prom goes much better when santana and quinn rig the votes so rachel and finn win prom queen and king,1,0,0
97095_7, the movie is around i think two to two and a half hours long umm and every minute of it is action,1,0,0
234587_4, it it stutter won an oscar for best picture in nineteenninetyone,1,0,0
33439_6, umm you know stutter its a its a stutter solid movie,1,0,0
327283_7, my mind was like completely blown with the with the movie with the twists with everything,1,0,0
208416_16, enjoyable and a escape from reality,1,0,0
2o2ljA0QD7g_11,you have to pay a small consulting fee  to  and then you can work out some sort of arrangement where you pay a small amount of money or maybe you give that attorney for a little less money a couple of points or ownership in the film,0,1,0
nZFPKP9kBkw_2,and then i think within the organization giving people the opportunity to try new and innovative approaches and make mistakes even,0,1,0
8Cp8c-eQELQ_16,this will be very important for those of you that draw income on a monthly basis or a quarterly basis off of your portfolio,0,1,0
MCsvw5-7lVE_4,and really invest in sort of answering any questions that your customers have,0,1,0
0bxhZ-LIfZY_4,education health care all these critical if not dealt with and kept to the last will turn india into less of a superpower than it can be,0,1,0
-9y-fZ3swSY_7,the better way to use this or the better word to say is excuse me ms excuse me mam,1,0,0
b-FX9NOVQOM_4,its us against them its not us us us them them them and the big man  no,0,1,0
ZzL2sHtTWRc_1,we have no secret formula of being able to understand exactly what is going to work,0,1,0
102408_4, umm the little boys liked it the little girls fell asleep,1,0,0
2f6ZHqJ76EU_8,it does many things by asking this question first of all it helps all the people who want to enter the contest actually think and understand the concept it what a credit union is in the first place,1,0,0
kj63uF0RhW8_7,so thats a great place to start if you dont have your own money and friends and family arent willing to lend or gift you money,0,1,0
nKiC9sEP2vM_1,the following information is a rundown of key sustainability news items for the month of october,0,1,0
DZIFCYOhosQ_3,on july th however the hoffman report tilted our professional world,1,0,0
257534_1, today im here to talk about the movie boarding gate,0,1,0
34-ogj6rh6w_8,you convinced me paula but how can i organize such a knowledge market,0,1,0
VZqkWIPmH6w_8,it is inspiring to to feel involved with humans to live with grief and to share in times of joy and national pride,0,1,0
j1m6ctAgjsM_24, and then all of our oneonone meetings happen weekly on mondays as well,0,1,0
9zWeMrfr-l0_6,weve been riding for  months,0,1,0
207812_4, so i thought that was really cool,1,0,0
flv4by3RYVk_5,the pitch is if you dont get it in two days its free,1,0,0
AGFgaKPzjMQ_10,experts say if you’re happy with your sleep quality keep sharing a bed,0,1,0
JwzxqrD8tIo_6,if shes riding the bike or if she just got done with a swim something to that affect,1,0,0
DZIFCYOhosQ_6,some people are convinced we need a president with highlevel apa governance experience to lead apa,0,1,0
122842_11, and harrison ford returns as han solo and this is just uhh a really awesome movie,1,0,0
5fKPJPFqPho_6,for real legislative council elections  members are elected,1,0,0
SzJf6viBWBg_4,it really depends on the interest rate that youre paying on that student loan debt,0,1,0
cn0WZ8-0Z1Y_4,they survive and they are allowed to go on being careless,1,0,0
SqAiJrvHXNA_5, it is random so probably a little big above average in a lot of things you see out there so nothing overly spectacular about the board length,1,0,0
264446_18, i think thats kind of refreshing actually because uhh i found uhh a lot of the homosexual movies focus too much on you know the idea that theyre being persecuted or that its so hard to be gay in todays society or you know theyre always looked down upon and they struggle through life,1,0,0
234053_4, its a story uhh about sigh king stutter leonidas and uhh his battle with three hundred spartan warriors,1,0,0
ROcTx5VEn7o_1,there are two approved ways of reporting income to external users,1,0,0
JOK1SSmPtFw_20, don’t forget that the quiz closes on thursday night and the exam will be open for  hours beginning midnight thursday and closing at midnight on friday,0,1,0
FphtHpVV-7w_6,are you bearing good fruit every single day for jesus because you are a good fruitbearing tree,0,1,0
213619_7, uhh this movie first starts off as like a x rated because you see a lot of girls who has and a lot of guys ding dongs,1,0,0
201582_3, umm he grew up to be a strong athlete,0,1,0
238060_3, uhh he is a very good actor and i was glad to see him in this movie,1,0,0
79356_1, absolutely fantastic movie made by kevin costner it won seven academy awards back in nineteen ninetyone and if you havent seen this movie then where have you been because this movie is fantastic,1,0,0
ZRic9ygn9f8_4,we believe that efforts to promote engagement and reconciliation among bahrainis are necessary to longterm stability,0,1,0
8404_2, i thought it was just gonna have lots of umm lots of blood lots of violence and thats all it was gonna be about,1,0,0
YWjTWl0oNLk_6,this brings us to the new celebrity system of late night,1,0,0
J3-NEG8uoiE_23,and most humans wouldn’t be able to survive in the wild especially since we’ve modernized ourselves to the luxuries of technology and civilization,0,1,0
SMr2DprlLu4_1,i like fixing things stuff that really gets you going,1,0,0
OXsTIPdytiw_13,or in some way try to figure out what theyre saying and try to put it in context of what actually occurred,0,1,0
117tQqLjza4_8,and theyre doing creative things there to make sure that they leverage whatever inventory they have that is appreciated by the ebay buyer,0,1,0
TBwetweXRb4_4,its been embedded in our strategic planning in our mission its embedded in the way in which we design our programs and services,0,1,0
213619_8, so if you can get past that its not that bad,1,0,0
uN0d3ZOkDp8_2,it also has been shown to increase time to fatigue decrease biomarkers of stress and increases testosterone secretions from cells,1,0,0
23YlZoucbyM_4,youll go onto any christian website and youll have somebody who is ready to fight oh what are your thoughts about flat earth,0,1,0
298736_21, the movie itself was fun it was enjoyable,1,0,0
40260_24, uhh uhh laura linney jeff goldblum uhh delacorp employees and dan murray as matthias playing the lead uhh face of delacorp,0,1,0
257045_3, its about family and love and drama and has some stutter comedy,1,0,0
UNQDdiAbWI_7,so this adorable stuffed monkey a sponge pack of trading cards some breakfast cereal some pencils some postits a hamburger and fries,0,1,0
hASTLbFHrEs_8,it actually causes it to last longer,1,0,0
jV6qzF2YROc_1,it was then reorchestrated by him into smaller suites in   and  the one were going to perform tonight is the  version which is the most frequently performed,1,0,0
92291_3, but sadly what happens is that umm his house actually becomes very very expensive to fix up and he has to deal with this like really weird crazy contractor and its just a barrel of laughs,1,0,0
52068_9, umm daniel wants myagi to help him get ready for a tournament and umm myagi doesnt want to do it,1,0,0
L0WUuWYNeCo_9, australians are notorious for under estimating estimating how much funds they need or are likely to need in their retirement years,0,1,0
97095_26, its not just action only,1,0,0
23656_2, now im a fan of harry potter ive seen all the harry potter movies,1,0,0
Emi9cw9xa00_5,without a successful emotional engagement with the customer customers leave,0,1,0
zaTyjiyrHnk_5,you can make statements like now weve already talked about xyz or now remember we talked about how important xyz is and what you dont want to forget is xyz so theres nothing wrong with repetition,0,1,0
VybXjsmsjAY_9,at the end of this session on illegal discrimination you will be able to do four things,0,1,0
PmemTgQHagk_2,and this is because theres plenty of multinational companies out there crying out for graduates that speak two languages,1,0,0
295793_10, umm it did have uhh turk from scrubs fame umm and avon barksdale from the wire so some actors that i was familiar with,1,0,0
KD0w4BrNXQg_11,so no siestas long working hours and low pay how do we explain spanish unemployment,0,1,0
108793_14, and umm i have no idea what his name is but umm hes in some new movie coming out ive seen him in it he was on jay leno the other night,1,0,0
1A-aRhYx-GQ_32,so if youre still thinking on whether to buy the jump manual or another product that youre looking dont look any further,1,0,0
j1m6ctAgjsM_37, on the next day i might be with marketing etc,0,1,0
8vpoQ5UVpXE_1,in fact shuping yang herself said she too was proud in her message of apology,1,0,0
21Kxt5L9OBE_3,i thinks its an unfortunate occurrence at this time and it is our hope that it resolves itself quickly and peacefully,1,0,0
N0GhVkCwrqw_9,i paid about a hundred ten hundred twenty for this one sort of as is and again i got kind of lucky,1,0,0
GpRDC-S88dM_4, the first thing i would like to do in  is stop moaning about petty things,1,0,0
faXGVcVcVsE_9, i also think its very important that when youre studying the diseases that you understand the top drugs that treat that disease,0,1,0
UUukBV82P9A_10,and a mismatch or contradiction between statuses is called a status inconsistency,0,1,0
yEtfjJOMMCs_16, just ask the judge first prior to adjusting your position,0,1,0
6qmReTSoz0E_1,and what im talking about fluency im talking about the flow of the way that youre speaking,0,1,0
88119_2, umm basically in this movie matt damon is a cia agent and it goes through the effects that it has on his life of how secretive it is and everything and umm having to keep the secrets even from his family and how this ruins his family life basically and umm about how the us government is corrupt uhh in a way and and stutter uhh interfere with other countrys affairs and everything,1,0,0
4lKz4xyCmkk_13,four to get the deaf or hearingimpaired persons attention say his or her name or wave or pat his or her shoulder,1,0,0
zj4PzGtFwJM_7,books dont hurt you theyre always there for you when you need them,1,0,0
257045_10, it has does have some funny scenes,1,0,0
111881_8, this is rated pg so you can watch this with your kids,1,0,0
RgubFcmvgDE_7,but then i learned that because of growth hormones and unnatural diets todays dairy cows produce ten times more milk than they would naturally,0,1,0
202826_11, george clooney does alright,0,1,0
ybK5wRaaUyE_19,do whatever it takes to be severed from the world because without being severed from the world there is no way you can be righteous in the eyes of jesus,0,1,0
8pvMpMdGM4_20, who is jerry when you are with christ when you are saved you cannot hold anything back you need to be fully one hundred percent on board to follow him for your life,1,0,0
ZjsQqd6KZIg_5,but unexpected was the softer confidence on services which fell quite sharply,0,1,0
NiAjz4ciA60_6, please be sure to reply otherwise well have to choose somebody else,0,1,0
273207_2, and it is described as a cute romantic comedy on the back,1,0,0
108146_2, all of the movies have george clooney matt damon brad pitt and so you know theyre nice to look at but oceans eleven and twelve were good,1,0,0
MZoLQD83R-4_8,remember those customers can hear whats going on around them to and when they hear that type of conversation or that type of language being used even if its not directed and them,0,1,0
hqzF4IDaIYE_6,they don’t always know what to do,0,1,0
Nmd50Uzyybs_5,but the whole idea of piercing the corporate veil has to do with the corporation through its officers and through the board of directors not acting in compliance with what the corporation articles of incorporation and corporate bylaws require,0,1,0
yBGuxyO-ElM_9,theyre not just watching an ad and then thinking ive got to go to the store tomorrow and buy that,1,0,0
yoDMh8FlHR8_4,it can’t just be something on the sidelines that you’re doing also because everybody else tells you you have to do,0,1,0
167521_7, they were done amazingly,1,0,0
0Xs8wJrAmxs_4,my partner is a physician at a military base where he sees every day the firsthand accounts of the ultimate prices that people pay for this country,0,1,0
XLjpZUsFEXo_11,well thats important you dont want to be doing it in a dark room,1,0,0
LpTbjgELALo_2,so what i was just saying yes they are but then again the quality and who they are is important,1,0,0
112425_6, umm i cook a lot laughter and so i can appreciate you know a lot of the uhh a lot of the food references that are made,1,0,0
WbtsuXkaGeg_12,you could copyright the whole record at one time or you could just go to copyrightgov and look under sound recordings and make sure you copyright that material,0,1,0
L1eFHRQGFeg_2, unfortunately i dont remember everything and im sure a lot   of my literacy development happened when i was born before i went to school which my mind didnt retain,1,0,0
283935_1, expotv i am dj mel here and i will be reviewing myself no i am not so why did i tell you my name anyways today i am reviewing stutter denzel washingtons deja vu,1,0,0
AIPqRuTjI4E_4,my guy the factory director used to work for polk audio quality control guy,0,1,0
140317_9, but if you like the idea of time travel and that kind of thing you might enjoy this because it gives you a little different idea about you know how things might be,1,0,0
YRmjALBdTdE_4,at least for this basic human interaction strategies,1,0,0
gU7McujYYPY_8,the second lesson is to be visual,1,0,0
215318_11, umm it does have a lot of special features if you like britney spears its got some music videos,1,0,0
fTNOAssiTYk_1,they want to be there on a regular basis and go through this super difficult thing of building a startup,0,1,0
DtbT85s3i94_1,but before we get into that lets talk about the arm path and hand separation ok,0,1,0
KLy4aBLqwCk_20,and so im very  very interested to see how consumers start conversations about particular products about particular services about particular environments,0,1,0
EmmuWoCUgXs_18,people are going to go to you when youre the only person that does certain type of events or photographs lets say its dancing,1,0,0
167521_16, i definitely recommend you guys watching that movie,1,0,0
yDIFWzOBjXc_15,since were on the bedtime questionnaire i should mention that weve added a question about napping how long did you spend napping today in total,0,1,0
YWjTWl0oNLk_7,its one of the biggest additions and its just the measure of notoriety among all sims,1,0,0
194625_3, the cast is just incredible,1,0,0
1k7br8xXMSU_15,theyre looking to be paid they want to make sure that theyre going to get their money so a lot of times with a new business starting out its going to be payment in advance or at least cod,0,1,0
367506_12, umm the special effects was great everything looked so realistic,1,0,0
261267_6, like i mean all disney stuff everything,1,0,0
194625_11, umm the costumes are great,1,0,0
Fmwc7wkIc4Q_2, is the firm a price taker or can it choose its price and if so how much would changing its price affect its profit sounds counterintuitive to you think of it this way,1,0,0
GMa0cIAltnw_6,if you fellowship with them knowing they are in sin then you also commit sin and you also will lose your relationship with jesus,0,1,0
TtAyUQtmTLk_3,this article really emphasizes the importance certainly from a narrative perspective of engaging externalizing conversations in our work,0,1,0
1W38PnuWIkM_4,so it was a revelation when years later she discovered a group called woza whose mission is the very opposite of silence,1,0,0
MvFFYObY9A8_1,the mouth is the gateway to your bodys health and a healthy mouth means a healthy body,0,1,0
OiMkqEH5WeE_3,however some individuals have basically have problems with their cash flow and they have to collapse their investment,0,1,0
2RDubrUjI-k_8,i would gladly recommend anyone with any sort of back or neck issue to go and see this truly exceptional practice,1,0,0
122842_7, umm really intense movie really cool,1,0,0
EJT25p7JahU_5,were also supporting syrians in preparing accountability cases against anybody with blood on their hands from any side,0,1,0
SwT0gh0V8fI_2,instead youre gonna get two separate videos that are going to have individual reviews for both books i read in february,0,1,0
234587_12, we also have twenty minutes worth of deleted scenes thats a lot of extra footage there for you to watch,1,0,0
244836_9, so i just thought it was uhh good performance by freddie highmore and a lame performance by robin williams,1,0,0
ZtocGyL3Tfc_24,so it is not a question of being optimistic or pessimistic it is just acknowledging that it is a difficult task and sometimes the current is less strong sometimes the current is stronger but it will always be against the current,1,0,0
80566_4, and they are almost an american icon,1,0,0
125895_5, i think its great for girls and i think its great for teenagers,1,0,0
22373_1, it has michael douglas and val kilmer in it,0,1,0
233356_1, so i think i finally hit the wall movie wise,1,0,0
Y6zyM1nDhN0_2,the same applies to nationals versus nonnationals,0,1,0
3fhCxePBuZY_2, a temporary order hearing is a hearing in which the court sets the ground rules for who gets what property what debts get paid who gets custody of the children and how much child support  if any  gets paid while the divorce is going through the court system,1,0,0
OKSx1zxHGpQ_19, they remember that conversation,0,1,0
201005_8, umm its interesting that steve martin is an an stutter attorney or lawyer but he wants to be a magician and umm lily tomlin umm is a spinster and i dont want to give away too much of the plot but she ends up being inside of umm her spirit becomes inside of umm steve martin and thats where a lot of the interesting things in the movie come in,1,0,0
Es9MkKsMsjU_5,because my familys not rich enough for them to care about,0,1,0
KZzFCrEyKF0_4,i don’t think we’re ever going to see everything going digital,0,1,0
Cd0JH1AreDw_4,these are questions that play out in every single place on the planet,0,1,0
40181_16, uhh its more of an a action comedy than umm any of the other ones were horror,1,0,0
Dnhxm6sHQpc_11,sometimes your other student loans may be on variable interest rate,0,1,0
juI9KoLA87A_4,and he looked at me and i asked him you know mr so and so why are you crying,1,0,0
G38DwNDQ8Cc_28,for once government needs to heed the law regarding the debt ceiling,0,1,0
97095_30, theres a lot of action,1,0,0
122602_9, uhh i really liked doc ock umm he was a great villain and i really enjoyed spiderman two and actually uhh it made up for spiderman one and i really couldnt wait for the third one to come out,1,0,0
WAXJRnJXmOA_10,the problem is when we dont have an assessment that gives us all of the information that we need,0,1,0
